{"$schema":"https://json-schema.org/draft/2020-12/schema","$id":"vsp003-style-category-resolution-map.schema.json","type":"object","additionalProperties":false,"required":["schema_version","map_id","style_profile_ref","rules"],"properties":{"schema_version":{"const":"1.0.0"},"map_id":{"const":"VSP003-SCRM-001"},"style_profile_ref":{"const":"VSP003"},"rules":{"type":"array","minItems":7,"items":{"type":"object","additionalProperties":false,"required":["category","authority_families","token_families","value_kinds","fallback"],"properties":{"category":{"enum":["shell_geometry","typography_hierarchy","body_composition","scientific_figure_metrics","connector_arrow_grammar","line_style_grammar","color_emphasis_grammar"]},"authority_families":{"type":"array","items":{"type":"string"}},"token_families":{"type":"array","items":{"type":"string"}},"value_kinds":{"type":"array","items":{"type":"string"}},"fallback":{"const":"explicit_implementation_fallback"}}}}}}
